{
  "schema_version": "1.0",
  "book": {
    "id": "sellerboard-reports",
    "title": "sellerboard Reports",
    "subtitle": "Complete reference to every downloadable report (Profit → Reports)",
    "authors": ["sellerboard"],
    "category": "amazon",
    "subcategory": "analytics-tools",
    "domain_relevance": "high",
    "source_files": ["pasted-in-chat: sellerboard Reports article"],
    "one_line": "sellerboard's Reports page exports every major Amazon FBA data set (P&L, orders, ads, inventory, COGS, refunds) as Excel/CSV for offline analysis.",
    "thesis": "The Reports page at Profit → Reports is sellerboard's hub for downloading business data as spreadsheets. Ten report types cover daily/monthly/per-product P&L, orders, sales trends, advertising, repeat customers, historical stock, COGS, and refunds. Each report has standard controls (date range, Excel/CSV, download or email-when-ready) and a few have unique behaviors worth knowing before you rely on them.",
    "tags": ["sellerboard", "reports", "p&l", "ppc", "inventory", "cogs", "refunds", "export"]
  },

  "outline": [
    { "ref": "Overview", "title": "What the Reports page is", "summary": "Central hub (Profit → Reports) to download business data as spreadsheets for offline/BI analysis." },
    { "ref": "Common Controls", "title": "Shared controls", "summary": "Date-range picker, Excel/CSV format, Download button, email-when-ready, trial restriction." },
    { "ref": "Reports 1-3", "title": "Dashboard reports", "summary": "By Day / By Month / By Product — same P&L metrics at different granularity, plus a detailed-breakdown option." },
    { "ref": "Reports 4-10", "title": "Operational reports", "summary": "Orders, Sales by Product/Month, Advertising, Repeat Customers, Stock History, COGS, Refunds." },
    { "ref": "How-To Guides", "title": "Task recipes", "summary": "Step-by-step recipes for common exports (annual P&L, return rates, historical stock, COGS audit, ad export, retention)." },
    { "ref": "FAQ", "title": "Frequently asked questions", "summary": "Trial limits, ACOS vs TACOS, why single-date/no-date on some reports, file-size limits, format choice." }
  ],

  "concepts": [
    { "id": "sellerboard-reports.location-and-purpose", "name": "Where Reports live & what they're for", "type": "definition",
      "summary": "Reports are at Profit → Reports; they take live dashboard data offline as spreadsheets to share, feed BI tools, and analyze deeper than the browser allows.",
      "detail": "The Reports page is the central hub for downloading business data in spreadsheet format. It complements the live dashboards: use it to take data offline, share with the team, feed external tools (Looker Studio, Power BI, custom spreadsheets), and do deeper analysis than the browser UI supports. Each report shows a name + short description; clicking it expands a configuration panel where you set parameters before downloading.",
      "fba_application": "This is your raw-data tap for the Master Workbook — pull the same numbers sellerboard shows on screen into your own multi-account analysis.",
      "source_ref": "Overview; How the Reports Page Works", "tags": ["navigation", "purpose"] },

    { "id": "sellerboard-reports.common-controls", "name": "Common report controls", "type": "process",
      "summary": "Most reports share a From/To date picker, Excel (.xlsx) or CSV format, a Download button, and an optional email-when-ready for slow exports.",
      "detail": "Standard controls: (1) Date Range Picker — most reports need a From/To window shown on a two-month calendar. (2) File Format — Excel (.xlsx, default, formatted, opens in Excel/Sheets) or CSV (plain, no formatting, best for databases/BI/scripts, universally compatible). (3) Download button — triggers export; a 'Downloading' dialog shows while the file is prepared and closes when ready. (4) Email notification — for files under 16 MB you can have sellerboard email the file when ready so you can close the browser.",
      "steps": ["Open Profit → Reports", "Click the report to expand its panel", "Set From/To date range if required", "Pick Excel or CSV", "(Dashboard reports) optionally tick detailed breakdown", "Click Download", "Wait for the dialog to close, or click 'Email me when ready'"],
      "fba_application": "Pick CSV when importing into a database/BI tool; Excel when a human will eyeball it. Use email-when-ready for wide date ranges so a long export doesn't block you.",
      "source_ref": "Common Controls", "tags": ["controls", "csv", "excel", "date-range"] },

    { "id": "sellerboard-reports.trial-restriction", "name": "Reports require a paid subscription", "type": "rule",
      "summary": "Report downloads are blocked on a free trial; a paid sellerboard subscription (Settings → Billing) is required to download any report.",
      "detail": "Trial users cannot download reports. Attempting it shows a message directing you to subscribe under Settings → Billing. All report types become available immediately upon subscribing.",
      "fba_application": "Budget for the subscription if your workflow depends on exporting data for the Master Workbook.",
      "source_ref": "Common Controls (trial note); FAQ", "tags": ["billing", "trial"] },

    { "id": "sellerboard-reports.dashboard-by-day", "name": "Dashboard by Day", "type": "metric",
      "summary": "A day-by-day P&L export — one row per calendar day with the full set of dashboard metrics.",
      "detail": "Mirrors all metrics in the dashboard 'More' panel, one row per day in the range: Sales, Units, Refunds, Promo, Advertising cost, Shipping costs, Refund cost, Amazon fees, Cost of goods, Gross profit, Indirect expenses, Net profit, Estimated payout, Real ACOS, % Refunds, Sellable returns, Margin, ROI, Active subscriptions (SnS), Sessions, Unit session percentage. Date selection: range. Formats: Excel/CSV. Has the detailed-breakdown option.",
      "when_to_use": "Analyzing daily trends, spotting spike/drop days, building time-series charts.",
      "fba_application": "Detect the exact day a PPC change or stockout moved net profit; chart daily margin per account.",
      "source_ref": "Report 1", "tags": ["p&l", "daily", "dashboard"] },

    { "id": "sellerboard-reports.dashboard-by-month", "name": "Dashboard by Month", "type": "metric",
      "summary": "Identical metrics to Dashboard by Day but aggregated one row per calendar month.",
      "detail": "Same metric set as Dashboard by Day, aggregated monthly (one row per month). Date selection: range. Formats: Excel/CSV. Has the detailed-breakdown option.",
      "when_to_use": "Monthly P&L reviews, board reporting, year-over-year comparisons, long-term trends.",
      "fba_application": "Generate a clean 12-row annual P&L per account for review meetings (see the annual-pnl checklist).",
      "source_ref": "Report 2", "tags": ["p&l", "monthly", "dashboard"] },

    { "id": "sellerboard-reports.dashboard-by-product", "name": "Dashboard by Product", "type": "metric",
      "summary": "The most granular dashboard report — one row per product per day with the full P&L metric set.",
      "detail": "Combines daily breakdown with per-product breakdown: each row = one product on one day, with all dashboard metrics (Sales, Units, Refunds, Advertising cost, Gross profit, Net profit, Margin, ROI, etc.). Date selection: range. Formats: Excel/CSV. Has the detailed-breakdown option. Warning: produces very large files with many products × wide date ranges (one row per product per day).",
      "when_to_use": "SKU-level profitability over time, ranking best/worst products, product-specific P&L dashboards.",
      "fba_application": "Find which SKU dragged net profit on a bad day; build per-ASIN profit trends across accounts.",
      "source_ref": "Report 3", "tags": ["p&l", "product", "sku", "large-file"] },

    { "id": "sellerboard-reports.detailed-breakdown-caveat", "name": "Detailed-breakdown option & merge caveat", "type": "rule",
      "summary": "Ticking 'Show detailed breakdown' splits fees/refund-cost/COGS into component columns, but those columns vary by period so files can't be reliably merged across time.",
      "detail": "Only the three Dashboard reports offer 'Show detailed breakdown of Amazon fees, refund costs and COGS'. Enabled, each fee category is split into component columns instead of one aggregated figure. WARNING: the columns that appear depend on the fees present in that period — if Amazon introduced a new fee type in one period and not another, two exports will have different columns, making it hard/impossible to concatenate multiple files (e.g. one per month) in a spreadsheet. Use it only for one-off deep dives, not for multi-period combined reports.",
      "fba_application": "Leave it OFF when stacking monthly exports into the Master Workbook; turn it ON only to dissect a single period's fees.",
      "source_ref": "The 'Show Detailed Breakdown' Option; FAQ", "tags": ["fees", "cogs", "gotcha", "merge"] },

    { "id": "sellerboard-reports.orders", "name": "Orders report", "type": "metric",
      "summary": "Line-item export of every order in the range — the report for raw transaction-level data.",
      "detail": "One row per order (or order line item): Order ID and date, product info (title, ASIN, SKU), units ordered, sales revenue, coupon codes used, marketplace, customer and fulfillment details. Date selection: range. Formats: Excel/CSV. No special option.",
      "when_to_use": "Order reconciliation, coupon-usage review, auditing transactions, customer-behavior investigation, feeding external systems.",
      "fba_application": "Use this (not aggregates) to find which orders used a specific promo code or to reconcile a disputed transaction.",
      "source_ref": "Report 4", "tags": ["orders", "transactions", "coupons", "asin"] },

    { "id": "sellerboard-reports.sales-by-product-month", "name": "Sales by Product/Month", "type": "metric",